<?xml version="1.0" encoding="UTF-8"?>
<curso xmlns:xsi="http://www.w3.org/2001/XMLSchema-instance"
 xsi:noNamespaceSchemaLocation="practicaExtra.xsd" id="LND">
    <alumnos>30</alumnos>
    <materia obligatoria="si">LND</materia>
    <horas total="4"/>
    <profesor>
        <nombre>Inés</nombre>
        <apellidos>Mesa</apellidos>
        <especialidad>Informática</especialidad>
    </profesor>
</curso>
